ID,COURSE NAME,TEACHER NAME,NUMBER OF CREDITS,MAX STUDENT,DAY,SESSION1,SESSION2
MTH0007,Dai So Tuyen Tinh,Le Van Hop,3,100,MON,S2,S4
MTH0016,TH Dai So Tuyen Tinh,Nguyen Cao Dang,1,50,WED,S2,S5
MTH0015,TH Toan Roi Rac,Nguyen Cao Dang,1,50,WED,S2,S5
MTH0004,Vi Tich Phan 2B,Nguyen Vu Huy,3,100,SUN,S6,S9
MTH0018,TH Vi Tich Phan 2B,Le Van Chanh,1,50,TUE,S8,S11
CSC0001,Nhap Mon Lap Trinh,Truong Toan Thinh,4,100,WED,S9,S12
BAA0006,Tam Li Dai Cuong,Thanh Thao,2,150,THU,S10,S13
PHY0001,Vat Li 1,Trinh Hoa Lang,3,150,TUE,S10,S13
